{
  "$schema": "../../mascot.schema.json",
  "id": "parker-svg",
  "name": "Parker (SVG, legacy)",
  "description": "Static SVG example of Parker — kept as a reference for the svg-frames format. Not animated.",
  "type": "svg-frames",
  "frameWidth": 64,
  "frameHeight": 64,
  "idle": "parker-ms.svg",
  "walkRight": "parker-ms.svg",
  "tags": ["pnp", "community", "svg-example"],
  "hidden": true
}
